,use_category,use_subcategory,skintype,brand,product,size,price,details,ingredients,ratings,perc_respondrec,total_reviews,link,page
28,cleanser,toner,dry,Neutrogena,Rapid Clear 2-in-1 Fight & Fade Toner,Size 6.0 oz|,"Price
$9.99","Neutrogena Rapid Clear 2-in-1 Fight & Fade Toner is the first acne toner designed to reduce breakouts in just hours and help fade the look of post-acne marks for clearer, more even-toned skin. This toner removes oil as Micro-Clear Technology speeds maximum strength salicylic acid acne medicine straight to the source of breakouts. It is formulated with glycolic acid and is designed to speed surface skin cell exfoliation. The refreshingly clean formula is clinically proven to reduce pimple size, swelling, and redness in under eight hours and accelerates surface cell exfoliation to help fade the look of post-acne marks.

Benefits:
Reduces breakouts and helps fade the look of post-acne marks
For acne-prone skin
With maximum strength salicylic acid acne treatment and Micro-Clear Technology
Formulated with ingredients to help with skin cell exfoliation
Clinically proven to reduce pimple size, swelling, and redness in under 8 hours
Helps fade the look of post-acne marks
Clears breakouts","Active: Salicylic Acid 2%. Inactive: Water, Alcohol Denat., Butylene Glycol, PPG-5-Ceteth-20, C12-15 Alkyl Lactate, Sodium Citrate, Fragrance, Cocamidopropyl PG-Dimonium Chloride Phosphate, PEG/PPG-20/6 Dimethicone, Cetyl Lactate, Benzalkonium Chloride, Sodium Benzotriazolyl Butylphenol Sulfonate, Disodium EDTA, Sodium Hydroxide, Glycolic Acid, Yellow 6, Red 40.",4,,425 Reviews,https://www.ulta.com/rapid-clear-2-in-1-fight-fade-toner?productId=xlsImpprod1940047,1
29,cleanser,toner,dry,Mario Badescu,"Travel Size Facial Spray With Aloe, Herbs and Rosewater",Size 8.5 oz|,"Price
$5.00","#MBSkinTip: Mario Badescu Facial Sprays are meant to multi-task! Use it to before moisturizer to boost hydration, to dampen makeup brushes and sponges, as a final step after makeup application to give your look a dewy finish, and to refresh your face (and mood!) throughout the day.","Aqua (Water, Eau), Propylene Glycol, Aloe Barbadensis Leaf Juice, Rosa Canina Extract, Thymus Vulgaris (Thyme) Leaf Extract, Fucus Vesiculosus (Bladderwrack) Extract, Gardenia Florida Fruit Extract, Caprylyl Glycol, Hexylene Glycol, Polysorbate 20, Parfum (Fragrance), Phenoxyethanol, Sodium Chloride, Citronellol, Geraniol, CI 17200 (Red 33), CI 42090 (Blue 1)",4.6,,1165 Reviews,https://www.ulta.com/travel-size-facial-spray-with-aloe-herbs-rosewater?productId=xlsImpprod15511101,1
30,cleanser,toner,dry,Thayers,Travel Size Alcohol-Free Witch Hazel Toner,Size 8.5 oz|,"Price
$3.99","Thayers Travel Size Alcohol-Free Witch Hazel Toner is formulated with aloe vera and witch hazel extract in order to soothe and naturally cleanse the skin.

Cucumber Toner Benefits:
Formulated with vitamin C
Reduces puffiness and irritation
Antioxidants diminish clogged pores","Purified Water, Glycerin, Certified Organic Witch Hazel Extract Blend (Hamamelis Virginiana Extract (Witch Hazel*), Aloe Barbadensis Leaf Juice (Filet of Aloe Vera*)), Cucumis Sativus (Cucumber) Fruit Extract, Citrus Grandis (Grapefruit) Seed Extract, Phenoxyethanol, Caprylyl Glycol, Ethylhexylglycerin, Citric Acid, Potassium Hydroxide

* Denotes Certified Organic Ingredients

The carefully selected, naturally sourced ingredients in this product may have undergone limited processing. Variations in color, clarity, etc. can be expected from lot to lot due to our use of naturally occurring ingredients.",4.5,,209 Reviews,https://www.ulta.com/travel-size-alcohol-free-witch-hazel-toner?productId=pimprod2006477,1
31,cleanser,toner,dry,Dermalogica,Travel Size Multi-Active Toner,Size 8.0 oz|,"Price
$12.00","Already love Dermalogica for skin? Grab this travel-friendly size for skin health on the go! Multi-Active Toner is an ultra-light facial spritz that refreshes and hydrates the skin while smoothing the surface. Helps condition skin to prepare for proper moisture absorption. Recommended for all skin conditions. Contains no artificial fragrance or color.

We recommend that first-time Dermalogica users visit an authorized skin treatment professional for a client consultation in an ULTA store.

View Dermalogica skin treatments at all ULTA locations. Book your appointment today.","Water/Aqua/Eau, Butylene Glycol, Aloe Barbadensis Leaf Juice, Lavandula Angustifolia (Lavender) Extract, Melissa Officinalis Leaf Extract, Sodium Lactate, Sodium PCA, Sorbitol, Proline, Propylene Glycol, Malva Sylvestris (Mallow) Flower/Leaf/Stem Extract, Hedera Helix (Ivy) Leaf/Stem Extract, Cucumis, Sativus (Cucumber) Fruit Extract, Sambucus Nigra Flower Extract, Arnica Montana Flower Extract, Parietaria Officinalis Extract, Ricinoleth-40, Polysorbate 20, Methyl Gluceth-20, PEG-12 Dimethicone, Dipotassium Glycyrrhizate, Linalool, Polyquaternium-4, Disodium EDTA, Sodium Citrate, 1,2-Hexanediol, Caprylyl Glycol, Phenoxyethanol, Ethylhexylglycerin, Lavandula Angustifolia (Lavender) Oil.",4.5,,824 Reviews,https://www.ulta.com/travel-size-multi-active-toner?productId=xlsImpprod1620163,1
32,cleanser,toner,dry,Origins,United State Balancing Tonic,Size 2.0 oz|,"Price
$25.00","Origins tingly-cool, re-texturizing tonic that helps refine, rebalance & refresh faces with dry & oily places.

Exfoliates away flakes, pore-clogging debris & smooths rough spots. Laminaria helps de-shine the T-zone without stripping & protects moisture levels to prevent parching. Aromatic Bergamot, Spearmint & Lavender enliven the senses.

Key ingredient: Laminaria Saccharina
Also known as Broadleaf Kelp, this North American seaweed is mineral-rich, helps control oil & helps keep skin moisturized.

Formulated without:
Parabens
Phthalates
Sulfate-Detergent
Propylene Glycol
Mineral Oil
Petroleum
Paraffin
DEA
Polyethylene Beads
Animal Ingredients*.

*except cruelty free Honey & Beeswax

Find ULTA Beauty stores that carry Origins.","Water\Aqua\Eau, Lavandula Angustifolia (Lavender) Flower Extract, Anthemis Nobilis (Chamomile) Flower Extract, Alcohol Denat., Butylene Glycol, Anthemis Nobilis Flower Oil*, Mentha Viridis (Spearmint) Leaf Oil*, Pelargonium Graveolens Flower Oil*, Lavandula Hybrida Oil*, Citrus Aurantium Bergamia (Bergamot) Fruit Oil*, Styrax Benzoin Gum, Geraniol, Linalool, Citronellol, Eugenol, Limonene, Hamamelis Virginiana (Witch Hazel) Extract, Oryza Sativa (Rice) Bran Extract, Cladosiphon Okamuranus Extract, Laminaria Saccharina Extract, Eugenia Caryophyllus (Clove) Flower Extract, Hydrolyzed Soy Protein, Hydrolyzed Wheat Protein, Hydrolyzed Corn Protein, Coconut Acid, Jojoba Wax Peg-120 Esters, Caffeine, Glycerin, Polyquaternium-7, Sodium Hyaluronate, Dextrin, Yeast Extract\Faex\Extrait De Levure, Disodium Edta, Phenoxyethanol.

Please be aware that ingredient lists may change or vary from time to time. Please refer to the ingredient list on the product package you receive for the most up to date list of ingredients.",4.5,,233 Reviews,https://www.ulta.com/united-state-balancing-tonic?productId=xlsImpprod15071347,1
33,cleanser,toner,dry,Skinfood,Peach Sake Toner,,"Price
$15.00","SKINFOOD's Peach Sake Toner is a refreshing toner made with rice sake and peach extracts, rich in vitamins A and C, which minimize shine and the appearance of pores.

Peaches contain significant vitamins and minerals which promote healthy skin. Peaches are rich in vitamin A and vitamin C, which are antioxidants that help reduce free radical damage and possess anti-aging benefits. Naturally occurring acid in the skin helps prevent acne and repair acne scars. The organic acid found in peaches can boost skin acid's rejuvenating effects. Finally, pectin, a type of fiber, is found in the skin of peaches and helps to tone and firm skin.

Sake, a wine made from rice, clears skin by facilitating blood circulation, while the alcohol also tightens pores and controls sebum production. Geishas, traditional artisans and performers in Japan, would add sake to bath water for softer, brighter skin. Following their fashion, sake spas offer luxurious sake baths and treatments. The fermentation process produces kojic acid, which has brightening effects on skin. The yeast used in the process also contains peptides, which are chains of amino acids that play a role in effective collagen production. ","Water, Alcohol Denat., Butylene Glycol, Diethoxyethyl Succinate, Hexylene Glycol, Prunus Persica (Peach) Fruit Extract, Allantoin, Bis-Peg-18 Methyl Ether Dimethyl Silane, Rice Ferment Filtrate (Sake), Enantia Chlorantha Bark Extract, Dimethicone, Propylene Glycol, Glycyrrhiza Glabra (Licorice) Root Extract, Centella Asiatica Extract, Glycine Soja (Soybean) Seed Extract, Peg-60 Hydrogenated Castor Oil, Oleanolic Acid, Hydrogenated Lecithin, Chamomilla Recutita (Matricaria) Flower Extract, Stearyl Glycyrrhetinate, Argania Spinosa Kernel Oil, Sesamum Indicum (Sesame) Seed Oil, Disodium Edta, Beta-Sitosterol, Serenoa Serrulata Fruit Extract, Bht, Tocopherol, Ethylhexylglycerin, 1,2-Hexanediol, Phenoxyethanol, D&C Red No.33(Ci 17200), Fd&C Yellow No.5(Ci 19140), Fd&C Yellow No.6(Ci 15985), Fragrance.",4.5,,180 Reviews,https://www.ulta.com/peach-sake-toner?productId=xlsImpprod14431231,1
34,cleanser,toner,dry,Pixi,Retinol Tonic,,"Price
$18.00","This potent youth preserving Retinol Tonic features a unique time-release Retinol to help rejuvenate the skin for a natural glow. Powerful antioxidants and botanicals replenish the skin for a smoother, softer appearance while soothing sensitive skin.","Aqua/Water/Eau, Rosemarinus Officinalis (Rosemary) Leaf Water, Glycerin, Propanediol, Methyl Gluceth-20, PEG-8, Panthenol, Magnesium Ascorbyl Phosphate, Sodium Hyaluronate, Lecithin, Oenothera Biennis (Evening Primrose) Flower Extract, Hibiscus Rosa-Sinensis Flower Extract, Sodium Acrylates Copolymer, Palmitoyl Tripeptide-27, Hydroxypropyl Cyclodextrin, Retinol, Phenoxyethanol, Caprylic/Capric Triglyceride, Jasminum Officinale (Jasmine) Flower/Leaf Extract, Lavandula Angustifolia (Lavender) Flower/Leaf/Stem Extract, Eugenia Caryophyllus (Clove) Flower Extract, Vitis Vinifera (Grape) Fruit Extract, Sodium Citrate, PEG-40 Hydrogenated Castor Oil, Disodium EDTA, Citric Acid, Polysorbate 20, Ethylhexylglycerin.",4.8,,5 Reviews,https://www.ulta.com/retinol-tonic?productId=pimprod2013502,1
35,cleanser,toner,dry,StriVectin,Tri-Phase Daily Glow Toner,Size 1.7 oz|,"Price
$39.00","This 3-in-1 daily toner is the secret to a glowing complexion. A blend of skin transforming acids and nourishing botanical extracts come together in this three-phase formula to smooth, hydrate and brighten for a radiant, lit-from-within glow.
Phase 1: Mandelic Acid, a gentle AHA suitable for even sensitive skin, is known to help refine and clarify the complexion while Squalane Oil replenishes skin
Phase 2: Lactic Acid brightens and restores radiance
Phase 3: Hyaluronic Acid deeply hydrates plus a comforting blend of Aloe Leaf & Calendula Flower extracts soothes dry, fatigued skin
With continued use, clinically proven to leave skin visibly brighter and more radiant with a healthy-looking glow*
*Based on consumer evaluation at 4 weeks when used as directed

StriVectin products are:
cruelty free
paraben free
suitable for all skin types

StriVectin is a collection of smart, targeted solutions for aging and changing skin. They combine advanced, high-performance skincare ingredients with their patented NIA-114 technology to deliver real, visible, clinically proven results.","Water/Aqua/Eau, Dimethicone, Squalane, Hexylene Glycol, Butylene Glycol, Sodium Chloride, Glycerin, Sodium Hyaluronate, Myristyl Nicotinate, Glycyrrhiza Uralensis (Licorice) Root Extract, Daucus Carota Sativa (Carrot) Root Extract, Rice Amino Acids, Diglucosyl Gallic Acid, Beta-Carotene, Jania Rubens Extract, Glycine Soja (Soybean) Oil, Boswellia Serrata Gum, Mandelic Acid, Leuconostoc/Radish Root Ferment Filtrate, Malic Acid, Sodium Carrageenan, Lactic Acid, Bacillus/Sea Salt Ferment Filtrate, Disodium EDTA, Honey/Mel/Miel, Salicylic Acid, Aminomethyl Propanol, Citric Acid, Ethylhexylglycerin, Tocopherol, Dipropylene Glycol, Pentylene Glycol, Fragrance (Parfum), Cetrimonium Chloride, Phenoxyethanol, Benzoic Acid, Benzyl Benzoate, Geraniol, Benzyl Salicylate, Citronellol, Citral, Limonene, Linalool, Benzyl Alcohol, CI 42090 (Blue 1), CI 17200 (Red 33).",4.6,,103 Reviews,https://www.ulta.com/tri-phase-daily-glow-toner?productId=pimprod2004439,1
36,cleanser,toner,dry,Exuviance,SkinRise Bionic Tonic,Size 5.0 oz|,"Price
$45.00","Bring new life to stressed skin with Exuviance's SkinRise Morning Glow. Start the day with a Bionic power boost designed to gently exfoliate skin's surface and give rise to a radiant, luminous complexion. This unique product invigorates skin with a daily dose of antioxidant multivitamins, PHA/Bionic and Green Tea and Cucumber Extracts. One swipe of a pad gently awakens and renews to impart a youthful glow.

Same product, new look! Exuviance Skinrise Morning Glow.","Aqua/water/eau, Butylene Glycol, Polysorbate 80, Gluconolactone, Propylene Glycol, Lactobionic Acid, Tocopheryl Acetate, Tetrahexyldecyl Ascorbate, Retinyl Palmitate, Arginine, Glycerin, Chondrus Crispus Extract, Mentha Piperita (peppermint) Oil, Eucalyptus Globulus Leaf Oil, Cucumis Sativus (cucumber) Fruit Extract, Citrus Grandis (grapefruit) Peel Oil, Camellia Sinensis Leaf Extract, Menthyl Lactate, Polysorbate 20, Citric Acid, Ammonium Hydroxide, Disodium EDTA, Chlorphenesin, Phenoxyethanol, Methylparaben, Parfum (fragrance), Hexyl Cinnamal, Butylphenyl Methylpropional, Limonene, Blue 1 (CI 42090), Yellow 5 (CI 19140).",4.7,,128 Reviews,https://www.ulta.com/skinrise-bionic-tonic?productId=prod2064351,1
37,cleanser,toner,dry,Mario Badescu,Witch Hazel & Lavender Toner,Size 4.6 oz|,"Price
$14.00","Soothe and refresh stressed skin. Formulated with Witch Hazel and infused with a blend of Aloe, Lavender Essential Water, and Lavender Oil. Mario Badescu's Witch Hazel & Lavender Toner provides a clarifying, post-cleanse boost without stripping skin of its natural moisture. Calm and clarity are restored to skin revealing a balanced, fresh-faced complexion.","Aqua (Water, Eau), Aloe Barbadensis Leaf Juice, Glycerin, Hamamelis Virginiana (Witch Hazel) Water, Lavandula Angustifolia (Lavender) Flower Water, Pentylene Glycol, Polysorbate 20, Hamamelis Virginiana (Witch Hazel) Leaf Extract, Lavandula Angustifolia (Lavender) Oil, Citric Acid, Propylene Glycol, Caprylyl Glycol, Phenoxyethanol, Chlorphenesin, Potassium Sorbate, Sodium Benzoate, Benzoic Acid, Sodium Chloride, Sodium Sulfate, CI 60730 (Ext. Violet 2).",3.9,,51 Reviews,https://www.ulta.com/witch-hazel-lavender-toner?productId=pimprod2005017,1
38,cleanser,toner,dry,Mario Badescu,"Travel Size Facial Spray with Aloe, Cucumber and Green Tea",Size 4.2 oz|,"Price
$5.00","#MBSkinTip: Mario Badescu Facial Sprays are meant to multi-task! Use it to before moisturizer to boost hydration, to dampen makeup brushes and sponges, as a final step after makeup application to give your look a dewy finish, and to refresh your face (and mood!) throughout the day.","Aqua (Water, Eau), Propylene Glycol, Mentha Piperita (Peppermint) Leaf Water, Cucumis Sativus (Cucumber) Fruit Water, Aloe Barbadensis Leaf Juice, Camellia Sinensis Leaf Extract, Cucumis Sativus (Cucumber) Fruit Extract, Fucus Vesiculosus (Bladderwrack) Extract, Propanediol, Polysorbate 20, Ethylhexylglycerin, Benzophenone-4, Parfum (Fragrance), Sodium Chloride, Citric Acid, Potassium Sorbate, Sodium Benzoate, Hexyl Cinnamal, Limonene, Linalool, CI 19140 (Yellow 5), CI 42090 (Blue 1)",4.6,,489 Reviews,https://www.ulta.com/travel-size-facial-spray-with-aloe-cucumber-green-tea?productId=xlsImpprod15471025,1
39,cleanser,toner,dry,Mamonde,Rose Trial Kit,Size 5 oz|,"Price
$22.00","A rose lover's dream come true! Mamonde's rose-infused trio is bursting with the intoxicating aroma of fresh-picked Damask Roses. Pamper skin with refreshing rose water for intense hydration and lasting moisture.

Petal Spa Oil To Foam (1.69 oz)
An oil to foam formula for quick and easy cleansing. Gently dissolves makeup with oil then forms a creamy foam with the addition of water to remove any remaining residue.

Rose Water Toner (1.69 oz)
Made with Damask Rose, this refreshing hydrator deeply infuses skin with soothing moisture.

Rose Gel Cream (0.84 oz)
A refreshing, watery gel cream infused with 68.7% Damask Rose Water. The roses are picked at their peak in the morning dew for the most soothing, hydrating benefit. Leaves complexion soft, fresh and dewy.","This item is not eligible for coupon discounts. See 
Opens in a new window
ulta.com/coupons for details.",4.7,,46 Reviews,https://www.ulta.com/rose-trial-kit?productId=pimprod2003991,1
40,cleanser,toner,dry,Derma E,Anti-Blemish Clarifying Bi-Phase Toner,Size 36 ct|,"Sale Price
$11.16
Original Price
$13.95","Derma E's Anti-Blemish Clarifying Bi-Phase Toner penetrates deeply to help purify while balancing skin's natural moisture levels after cleansing. This lightweight yet powerful bi-phase liquid essence is formulated with paprika extract for antioxidant properties and natural tea tree oil to help clarify and exfoliate skin. Calming chamomile, antioxidant-rich vitamin E oil, and nourishing rosewater help to soothe skin for a clearer, healthy-looking complexion.

Benefits:
100% Vegan
Cruelty-free
Recyclable & wind energy certified
Formulated without GMOs, gluten, or soy
For teens to adults","Water Phase: Purified Water, Glycolic Acid, Polysorbate 20, Sodium Hydroxide, Aloe Barbadensis Leaf Juice, Glycerin (vegetable Derived), Panthenol (provitamin B5), Sodium Hyaluronate, Cucumis Sativus (cucumber) Fruit Extract, Rosa Damascena Flower Water, Leuconostoc/radish Root Ferment Filtrate, Chamomilla Recutita (matricaria) Flower Extract, Ethylhexylglycerin, Phenoxyethanol.

oil Phase: Isopropyl Palmitate, Hydrogenated Polyisobutene, Caprylic/capric Triglyceride (vegetable Derived), Tocopheryl Acetate (vitamin E), Melaleuca Altrernfolia (tea Tree) Leaf Oil, Paprika Extract.",4.6,,80 Reviews,https://www.ulta.com/anti-blemish-clarifying-bi-phase-toner?productId=pimprod2011614,1
41,cleanser,toner,dry,Exuviance,Hydraprep pH Balance Toner,Size 8.0 oz|,"Price
$29.00","HydraPrep pH Balance Toner from Exuviance is formulated to hydrate and target the skin's natural pH balance. Contains the Alpha Hydroxy Acid (AHA) Glycolic Acid, with PHA and conditioning botanicals to prepare skin for your optimized Exuviance intention skincare steps. Dermatologist and Allergy tested.

Same product, new look! Exuviance Hydraprep pH Balance Toner.","Aqua/water/eau, Alcohol Denat., Butylene Glycol, Octoxynol-12, Glycolic Acid, Gluconolactone, Sodium Hyaluronate, Aloe Barbadensis Leaf Extract, Algae Extract, Cucumis Sativus (cucumber) Fruit Extract, Rosmarinus Officinalis (rosemary) Leaf Extract, Chamomilla Recutita (matricaria) Flower Extract, Althaea Officinalis Root Extract, Glycerin, Propylene Glycol, Caprylyl Glycol, Polysorbate 20, Disodium EDTA, Ammonium Hydroxide, Phenoxyethanol, Chlorphenesin, Parfum (fragrance), Blue 1(CI 42090), Yellow 5 (CI 19140).",4.7,,23 Reviews,https://www.ulta.com/hydraprep-ph-balance-toner?productId=xlsImpprod14921089,1
42,cleanser,toner,dry,Mario Badescu,"Travel Size Facial Spray with Aloe, Chamomile and Lavender",Size 2.0 oz|,"Price
$5.00","#MBSkinTip: Mario Badescu Facial Sprays are meant to multi-task! Use it to before moisturizer to boost hydration, to dampen makeup brushes and sponges, as a final step after makeup application to give your look a dewy finish, and to refresh your face (and mood!) throughout the day.","Aqua (Water, Eau), Lavandula Angustifolia (Lavender) Flower Water, Propylene Glycol, Polysorbate 20, Aloe Barbadensis Leaf Juice, Lavandula Angustifolia (Lavender) Oil, Chamomilla Recutita (Matricaria) Flower Extract, Fucus Vesiculosus (Bladderwrack) Extract, 3-O-Ethyl Ascorbic Acid, Thymus Vulgaris (Thyme) Leaf Extract, Potassium Sorbate, Sodium Benzoate, Benzophenone-4, Triethanolamine, Propanediol, Sodium Sulfate, Citric Acid, Ethylhexylglycerin, Sodium Chloride, CI 60730 (Violet 2)
",4.5,,116 Reviews,https://www.ulta.com/travel-size-facial-spray-with-aloe-chamomile-lavender?productId=xlsImpprod17411019,1
43,cleanser,toner,dry,TONYMOLY,The Chok Chok Green Tea Cleansing Water,Item 2541512,"Price
$15.50","The Chok Chok Green Tea Cleansing Water from TONYMOLY removes skin impurities while also providing gentle hydration so even the most sensitive skin can achieve a deep cleanse without skin feeling tight and stripped of its natural oils. Infused with 10,000 ppm of our specially fermented green tea, this antioxidant-rich cleansing water purifies and refreshes tired skin with a one-step cleanse by sweeping away makeup and other skin-clogging impurities and prepping the skin for the following skincare. This water features a special fermented Korean green tea called 'ChungTaeJeon' with over a thousand years of history. 'ChungTaeJeon', the world's first naturally fermented green tea, is fermented through sunlight for over 365 days and provides gentle yet intense moisture and hydration that lasts.

Key Ingredients:
Pure Fermented Green Tea Extract - naturally fermented green tea with high antioxidant and moisturizing benefits to skin, much higher than that of fresh green tea
Lemon Seed Oil - filled with antibacterial and anti-fungal properties
Rosewood Oil - soothing and revitalizing","Water, PEG-6 Caprylic/Capric Glycerides, Dipropylene Glycol, Betaine, Camellia Sinensis Leaf Extract, PEG-40 Hydrogenated Castor Oil, Allantoin, Citrus Limon (Lemon) Seed Oil, Aniba Rosaeodora (Rosewood) Wood Oil, Disodium EDTA, Sodium Citrate, Citric Acid, Phenoxyethanol, Ethylhexylglycerin.",4.7,,12 Reviews,https://www.ulta.com/chok-chok-green-tea-cleansing-water?productId=pimprod2008472,1
44,cleanser,toner,dry,Kiehl's Since 1851,Rare Earth Pore Refining Tonic,Size 2.0 oz|,"Price
$22.00","Rare Earth Pore Refining Tonic from Kiehl's is dual-phase facial toner that helps remove excess dirt and toxins for cleaner skin. Formulated with Amazonian White Clay, this toner also helps absorb surface oil, refine the appearance of pores and rebalance skin's moisture. Over time, skin feels and appears softer, smoother and more matte.","Aqua/Water, Alcohol Denat., Glycerin, Propanediol, Silica, Phenoxyethanol, Zinc Oxide, Methyl Methacrylate Crosspolymer, Kaolin, Zinc Gluconate, Aloe Barbadensis/Aloe Barbadensis Leaf Juice, Avena Sativa Flour/Oat Kernel Flour, Menthoxypropanediol, Hamamelis Virginiana Water/Witch Hazel Leaf Water, Allantoin, Salicylic Acid",4.5,,45 Reviews,https://www.ulta.com/rare-earth-pore-refining-tonic?productId=pimprod2002896,1
45,cleanser,toner,dry,Kiehl's Since 1851,Ultra Facial Oil-Free Toner,Size 6.7 oz|,"Price
$18.00","Balance and freshen skin with a hydrating facial toner. The alcohol-free formula in Kiehl's Ultra Facial Oil-Free Toner gently removes dirt and residue without stripping skin of moisture. This formula also helps remove excess oil on skin's surface for fresh, healthy-looking skin. Formulated with Desert Plant Extract and Glacial Glycoprotein, this non-drying toner helps soothe and hydrate skin. Ultra Facial Oil-Free Toner is tested for safety and gentleness and pH-balanced. Find your refresh!","Aqua/Water, Glycerin, Propanediol, Phenoxyethanol, Propylene Glycol, Potassium Sorbate, Acrylates/C10-30 Alkyl Acrylate Crosspolymer, Triethanolamine, Citric Acid, Imperata Cylindrica Root Extract, Pseudoalteromonas Ferment Extract, Sodium Hyaluronate, Cucumis Sativus Juice/Cucumber Fruit Extract, Caprylyl Glycol, Carbomer.",4.5,,42 Reviews,https://www.ulta.com/ultra-facial-oil-free-toner?productId=pimprod2002908,1
